{
  "schema_version": "1.0",
  "id": "T-01KFGH1Q50V9T6N2W7751VDRN0",
  "title": "Seed: Child",
  "status": "closed",
  "type": "task",
  "priority": "critical",
  "severity": "critical",
  "assignees": [],
  "milestone_id": null,
  "tags": [
    "seed",
    "rel"
  ],
  "created_at": "2026-01-21T14:58:57.31288Z",
  "updated_at": "2026-01-21T17:07:15.085093Z",
  "closed_at": "2026-01-21T17:07:12.02377Z",
  "summary": "Child relationship sample",
  "description": "Seed fixture for parent/child relationships",
  "acceptance": [],
  "estimate": null,
  "due_at": null,
  "relations": [
    {
      "type": "child",
      "id": "T-01KFGH1Q3T5EBXR1ZKGD24RZEK"
    }
  ],
  "artifacts": [],
  "custom": {
    "component": "rel",
    "seed": true
  }
}