{
  "schema_version": "1.0",
  "id": "T-01KFGG0F653GY2WE9VE25BFA67",
  "title": "Document config",
  "status": "closed",
  "type": "chore",
  "priority": "low",
  "severity": "low",
  "assignees": [],
  "milestone_id": null,
  "tags": [
    "docs"
  ],
  "created_at": "2026-01-21T14:40:47.813651Z",
  "updated_at": "2026-01-21T15:21:07.911031Z",
  "closed_at": "2026-01-21T14:42:17.762596Z",
  "summary": "Add config examples",
  "description": "## Context\n\n## Requirements\n",
  "acceptance": [],
  "estimate": null,
  "due_at": null,
  "relations": [],
  "artifacts": [],
  "custom": {
    "component": "docs",
    "seed": true
  }
}