{
  "schema_version": "1.0",
  "id": "T-01KFGH1Q64DJ6D5815CNRW0VQA",
  "title": "Seed: Duplicate",
  "status": "open",
  "type": "task",
  "priority": "medium",
  "severity": "normal",
  "assignees": [],
  "milestone_id": null,
  "tags": [
    "seed",
    "rel"
  ],
  "created_at": "2026-01-21T14:58:57.348577Z",
  "updated_at": "2026-01-21T15:21:08.313736Z",
  "closed_at": null,
  "summary": "Duplicate relationship sample",
  "description": "Seed fixture for duplicate relationships",
  "acceptance": [],
  "estimate": null,
  "due_at": null,
  "relations": [
    {
      "type": "duplicate",
      "id": "T-01KFGG0F653GY2WE9VE25BFA67"
    }
  ],
  "artifacts": [],
  "custom": {
    "component": "rel",
    "seed": true
  }
}