{
  "schema_version": "1.0",
  "id": "T-01KFJZXJERGPXF3BDRES3QB9CB",
  "title": "Test agent attribution",
  "status": "open",
  "type": "task",
  "priority": "medium",
  "severity": "normal",
  "assignees": [],
  "milestone_id": null,
  "tags": [
    "test"
  ],
  "created_at": "2026-01-22T13:57:18.936332Z",
  "updated_at": "2026-01-22T13:57:18.936332Z",
  "closed_at": null,
  "summary": "Test agent attribution",
  "description": "## Context\n\n## Requirements\n",
  "acceptance": [],
  "estimate": null,
  "due_at": null,
  "relations": [],
  "artifacts": [],
  "custom": {}
}