{
  "schema_version": "1.0",
  "id": "T-01KFGH1Q3T5EBXR1ZKGD24RZEK",
  "title": "Seed: Parent",
  "status": "open",
  "type": "task",
  "priority": "medium",
  "severity": "normal",
  "assignees": [],
  "milestone_id": "M-01KFGH1PZYC5FWJQS3D9X1REES",
  "tags": [
    "seed",
    "rel"
  ],
  "created_at": "2026-01-21T14:58:57.274529Z",
  "updated_at": "2026-01-21T15:21:08.435395Z",
  "closed_at": null,
  "summary": "Parent relationship sample",
  "description": "Seed fixture for parent/child relationships",
  "acceptance": [],
  "estimate": null,
  "due_at": null,
  "relations": [
    {
      "type": "parent",
      "id": "T-01KFGH1Q50V9T6N2W7751VDRN0"
    }
  ],
  "artifacts": [],
  "custom": {
    "component": "rel",
    "seed": true
  }
}